Symbol,Name,Last Sale,Net Change,% Change,Market Cap,Country,IPO Year,Volume,Sector,Industry
JXJT,JX Luxventure Limited Common Stock,$1.71,0.19,12.50%,10368058.00,China,2013,29887,Consumer Staples,Apparel
JXN,Jackson Financial Inc. Class A Common Stock ,$98.58,-1.86,-1.852%,7417259357.00,United States,2021,541586,Finance,Life Insurance
JXN^A,Jackson Financial Inc. Depositary Shares each representing a 1/1000th interest in a share of Fixed-Rate Reset Noncumulative Perpetual Preferred Stock Series A,$27.26,-0.04,-0.147%,,United States,,17846,,
JYD,Jayud Global Logistics Limited Class A Ordinary Shares,$0.869,0.089,11.41%,18555082.00,China,2023,18346,Consumer Discretionary,Oil Refining/Marketing
JYNT,The Joint Corp. Common Stock,$11.70,0.29,2.542%,175462268.00,United States,2014,47291,Miscellaneous,Multi-Sector Companies
JZ,Jianzhi Education Technology Group Company Limited American Depositary Shs,$0.9801,0.0001,0.01%,19783319.00,China,2022,2486,Real Estate,Other Consumer Services
JZXN,Jiuzi Holdings Inc. Ordinary Shares,$1.62,0.0338,2.131%,14667477.00,China,2021,8684,Consumer Discretionary,Retail-Auto Dealers and Gas Stations
K,Kellanova Common Stock,$81.05,0.03,0.037%,27742425785.00,United States,,1643104,Consumer Staples,Packaged Foods
KACL,Kairous Acquisition Corp. Limited Ordinary Shares,$12.3065,0.8365,7.293%,0.00,Malaysia,2022,12603,Finance,Blank Checks
KACLR,Kairous Acquisition Corp. Limited Rights,$0.1163,0.0252,27.662%,0.00,Malaysia,2022,2026,Finance,Blank Checks
KACLU,Kairous Acquisition Corp. Limited Unit,$12.33,0.00,0.00%,0.00,Malaysia,2021,11,Finance,Blank Checks
KACLW,Kairous Acquisition Corp. Limited Warrants,$0.0171,0.0066,62.857%,0.00,Malaysia,2022,4772,Finance,Blank Checks
KAI,Kadant Inc Common Stock,$328.09,-6.59,-1.969%,3853274003.00,United States,1992,31902,Industrials,Industrial Machinery/Components
KALA,KALA BIO Inc. Common Stock,$5.20,0.0881,1.723%,23959359.00,United States,2017,9830,Health Care,Biotechnology: Pharmaceutical Preparations
KALU,Kaiser Aluminum Corporation Common Stock,$73.42,-0.35,-0.474%,1181115763.00,United States,,151576,Industrials,Metal Fabrications
KALV,KalVista Pharmaceuticals Inc. Common Stock,$12.50,0.41,3.391%,540193400.00,United Kingdom,2015,119396,Health Care,Biotechnology: Pharmaceutical Preparations
KAPA,Kairos Pharma Ltd. Common Stock,$1.4801,0.0101,0.687%,19007351.00,,2024,26553,Health Care,Biotechnology: Pharmaceutical Preparations
KAR,OPENLANE Inc. Common Stock,$16.51,0.18,1.102%,1793305402.00,United States,2009,375653,Consumer Discretionary,Retail-Auto Dealers and Gas Stations
KARO,Karooooo Ltd. Ordinary Shares,$40.00,0.04,0.10%,1236000000.00,Singapore,2021,25736,Technology,Computer Software: Prepackaged Software
KAVL,Kaival Brands Innovations Group Inc. Common Stock,$0.8999,0.0449,5.251%,6104884.00,United States,,208158,Consumer Discretionary,Other Consumer Services
KB,KB Financial Group Inc,$68.71,0.78,1.148%,26017991416.00,South Korea,,116679,Finance,Commercial Banks
KBDC,Kayne Anderson BDC Inc. Common Stock,$16.01,0.06,0.376%,0.00,,2024,17868,,
KBH,KB Home Common Stock,$85.26,1.53,1.827%,6252497509.00,United States,1986,950856,Consumer Discretionary,Homebuilding
KBR,KBR Inc. Common Stock,$70.51,1.08,1.556%,9381368192.00,United States,2006,1171072,Industrials,Military/Government/Technical
KC,Kingsoft Cloud Holdings Limited American Depositary Shares,$2.78,0.10,3.731%,705246115.00,China,2020,2275988,Technology,Computer Software: Prepackaged Software
KD,Kyndryl Holdings Inc. Common Stock,$25.16,0.14,0.56%,5817180297.00,United States,2021,794056,Technology,EDP Services
KDLY,Kindly MD Inc. Common Stock,$1.48,0.26,21.311%,8801810.00,United States,2024,827013,Health Care,Medical/Nursing Services
KDLYW,Kindly MD Inc. Warrants,$0.178,-0.0118,-6.217%,1058596.00,United States,2024,13861,Health Care,Medical/Nursing Services
KDP,Keurig Dr Pepper Inc. Common Stock,$36.94,0.44,1.205%,50093830766.00,United States,,9535638,Consumer Staples,Beverages (Production/Distribution)
KE,Kimball Electronics Inc. Common Stock,$18.45,-0.37,-1.966%,456330455.00,United States,,94874,Technology,Electrical Products
KELYA,Kelly Services Inc. Class A Common Stock,$20.17,-0.48,-2.324%,717413539.00,United States,,126326,Consumer Discretionary,Professional Services
KELYB,Kelly Services Inc. Class B Common Stock,$20.60,0.00,0.00%,732707928.00,United States,,13,Consumer Discretionary,Professional Services
KEN,Kenon Holdings Ltd. Ordinary Shares,$27.25,0.27,1.001%,1437869276.00,Singapore,2015,6798,Utilities,Electric Utilities: Central
KEP,Korea Electric Power Corporation Common Stock,$7.67,0.21,2.815%,9847728941.00,South Korea,1994,103516,Utilities,Electric Utilities: Central
KEQU,Kewaunee Scientific Corporation Common Stock,$32.28,0.23,0.718%,92701962.00,United States,,12872,Industrials,Medical Specialities
KEX,Kirby Corporation Common Stock,$122.24,-1.84,-1.483%,7077696000.00,United States,,291592,Consumer Discretionary,Marine Transportation
KEY,KeyCorp Common Stock,$17.35,0.10,0.58%,16364445968.00,United States,,10728700,Finance,Major Banks
KEY^I,KeyCorp Depositary Shares Each Representing a 1/40th Ownership Interest in a Share of Fixed-to-Floating Rate Perpetual Non-Cumulative Preferred Stock Series E,$25.57,-0.11,-0.428%,,United States,,11555,,
KEY^J,KeyCorp Depositary Shares each representing a 1/40th ownership interest in a share of Fixed Rate Perpetual Non-Cumulative Preferred Stock Series F,$23.35,-0.02,-0.086%,,United States,,16559,,
KEY^K,KeyCorp Depositary Shares each representing a 1/40th ownership interest in a share of Fixed Rate Perpetual Non-Cumulative Preferred Stock Series G,$23.77,-0.03,-0.126%,,United States,,16974,,
KEY^L,KeyCorp Depositary Shares each representing a 1/40th ownership interest in a share of Fixed Rate Perpetual Non-Cumulative Preferred Stock Series H,$24.90,-0.045,-0.18%,,United States,,50387,,
KEYS,Keysight Technologies Inc. Common Stock,$159.95,1.78,1.125%,27758259632.00,United States,2014,940769,Industrials,Industrial Machinery/Components
KF,Korea Fund Inc. (The) New Common Stock,$22.20,-0.06,-0.27%,0.00,United States,,7648,Finance,Investment Managers
KFFB,Kentucky First Federal Bancorp Common Stock,$3.27,-0.03,-0.909%,26443558.00,United States,2005,12951,Finance,Savings Institutions
KFRC,Kforce Inc. Common Stock,$55.58,-0.48,-0.856%,1077084820.00,United States,1995,214237,Consumer Discretionary,Professional Services
KFS,Kingsway Financial Services Inc. Common Stock (DE),$9.26,-0.20,-2.114%,257529147.00,Canada,,30856,Finance,Property-Casualty Insurers
KFY,Korn Ferry Common Stock,$70.65,-0.49,-0.689%,3674551999.00,United States,1999,663115,Consumer Discretionary,Diversified Commercial Services
KGC,Kinross Gold Corporation Common Stock,$10.61,0.46,4.532%,13039690000.00,Canada,2001,14948150,Basic Materials,Precious Metals
KGEI,Kolibri Global Energy Inc. Common stock,$3.44,0.06,1.775%,122931720.00,United States,,4455,Energy,Oil & Gas Production
KGS,Kodiak Gas Services Inc. Common Stock,$31.12,-0.27,-0.86%,2629939125.00,United States,2023,404766,Utilities,Natural Gas Distribution
KHC,The Kraft Heinz Company Common Stock,$36.00,0.05,0.139%,43526840292.00,United States,,5503680,Consumer Staples,Packaged Foods
KIDS,OrthoPediatrics Corp. Common Stock,$27.56,0.70,2.606%,667349581.00,United States,2017,85105,Health Care,Medical/Dental Instruments
KIM,Kimco Realty Corporation (HC) Common Stock,$24.62,0.15,0.613%,16596641527.00,United States,,3117629,Real Estate,Real Estate Investment Trusts
KIM^L,Kimco Realty Corporation Class L Depositary Shares each of which represents a one-one thousandth fractional interest in a share of 5.125% Class L Cumulative Redeemable Preferred Stock liquidation preference $25000.00 per share,$23.22,-0.36,-1.527%,,United States,,30732,,
KIM^M,Kimco Realty Corporation Class M Depositary Shares each of which represents a one-one thousandth fractional interest in a share of 5.25% Class M Cumulative Redeemable Preferred Stock liquidation preference $25000.00 per share,$23.99,-0.13,-0.539%,,United States,,37341,,
KIM^N,Kimco Realty Corporation Depositary Shares each representing 1/1000th interest in a share of 7.25% Class N Cumulative Convertible Perpetual Preferred Stock,$61.87,0.68,1.111%,,United States,,3780,,
KIND,Nextdoor Holdings Inc. Class A Common Stock,$2.51,-0.03,-1.181%,953570114.00,United States,,560636,Technology,Computer Software: Programming Data Processing
KINS,Kingstone Companies Inc. Common Stock,$9.79,-0.21,-2.10%,108323638.00,United States,,116425,Finance,Property-Casualty Insurers
KIO,KKR Income Opportunities Fund Common Shares,$14.29,-0.21,-1.448%,0.00,United States,2013,233047,Finance,Investment Managers
KIRK,Kirkland's Inc. COMMONSTOCK,$1.99,0.03,1.531%,26092160.00,United States,2002,26554,Consumer Discretionary,Other Specialty Stores
KITT,Nauticus Robotics Inc. Common stock,$1.42,0.09,6.767%,6602475.00,United States,2021,68326,Industrials,Industrial Machinery/Components
KITTW,Nauticus Robotics Inc. Warrant,$0.0133,0.00,0.00%,61840.00,United States,2021,2501,Industrials,Industrial Machinery/Components
KKR,KKR & Co. Inc. Common Stock,$139.81,1.97,1.429%,124072969483.00,United States,,2954178,Finance,Investment Managers
KKRS,KKR Group Finance Co. IX LLC 4.625% Subordinated Notes due 2061,$20.75,0.065,0.314%,18414377489.00,United States,2021,13042,,
KLAC,KLA Corporation Common Stock,$678.52,8.27,1.234%,91210065927.00,United States,1980,1192419,Technology,Electronic Components
KLC,KinderCare Learning Companies Inc. Common Stock,$28.35,0.08,0.283%,3242278623.00,,2024,304835,Consumer Discretionary,Other Consumer Services
KLG,WK Kellogg Co Common Stock,$17.63,0.45,2.619%,1514442370.00,United States,2023,916460,Consumer Staples,Packaged Foods
KLIC,Kulicke and Soffa Industries Inc. Common Stock,$44.55,-0.63,-1.394%,2428388335.00,Singapore,,518854,Technology,Semiconductors
KLTO,Klotho Neurosciences Inc. Common Stock,$0.7574,0.1674,28.373%,13049635.00,United States,2022,1356244,Health Care,Biotechnology: Biological Products (No Diagnostic Substances)
KLTOW,Klotho Neurosciences Inc. Warrant,$0.055,0.02,57.143%,947623.00,United States,2022,117443,Health Care,Biotechnology: Biological Products (No Diagnostic Substances)
KLTR,Kaltura Inc. Common Stock,$1.36,-0.03,-2.158%,202630401.00,United States,2021,85683,Technology,Computer Software: Prepackaged Software
KLXE,KLX Energy Services Holdings Inc. Common Stock,$4.74,-0.22,-4.435%,79937403.00,United States,,85514,Energy,Oilfield Services/Equipment
KMB,Kimberly-Clark Corporation Common Stock,$145.41,-0.68,-0.465%,48974731730.00,United States,,3915414,Consumer Discretionary,Containers/Packaging
KMDA,Kamada Ltd. Ordinary Shares,$5.44,0.14,2.642%,243929600.00,Israel,2013,18639,Health Care,Biotechnology: Pharmaceutical Preparations
KMI,Kinder Morgan Inc. Common Stock,$24.95,0.13,0.524%,55375592244.00,United States,2011,13668877,Utilities,Natural Gas Distribution
KMPB,Kemper Corporation 5.875% Fixed-Rate Reset Junior Subordinated Debentures due 2062,$23.55,0.035,0.149%,1517248620.00,United States,2022,6142,Finance,Property-Casualty Insurers
KMPR,Kemper Corporation,$63.64,-0.76,-1.18%,4100114743.00,United States,,279255,Finance,Property-Casualty Insurers
KMT,Kennametal Inc. Common Stock,$25.71,-0.44,-1.683%,2002829337.00,United States,,1206338,Industrials,Industrial Machinery/Components
KMX,CarMax Inc,$74.70,-0.42,-0.559%,11572848273.00,United States,,1198298,Consumer Discretionary,Retail-Auto Dealers and Gas Stations
KN,Knowles Corporation Common Stock,$17.72,-0.19,-1.061%,1566931455.00,United States,2014,395897,Consumer Staples,Consumer Electronics/Appliances
KNDI,Kandi Technologies Group Inc. Ordinary Shares,$1.55,-0.07,-4.321%,135405263.00,China,,290138,Consumer Discretionary,Auto Manufacturing
KNF,Knife Riv Holding Co. Common Stock,$93.44,-0.85,-0.901%,5289891155.00,United States,2023,209905,Industrials,Mining & Quarrying of Nonmetallic Minerals (No Fuels)
KNOP,KNOT Offshore Partners LP Common Units representing Limited Partner Interests,$6.39,-0.12,-1.843%,217548068.00,United Kingdom,2013,57812,Consumer Discretionary,Marine Transportation
KNSA,Kiniksa Pharmaceuticals International plc Class A Ordinary Shares,$26.26,-0.49,-1.832%,1870859877.00,United States,2018,162032,Health Care,Biotechnology: Pharmaceutical Preparations
KNSL,Kinsale Capital Group Inc. Common Stock,$473.22,-1.97,-0.415%,11019601092.00,United States,,76640,Finance,Property-Casualty Insurers
KNTK,Kinetik Holdings Inc. Class A Common Stock,$50.64,0.92,1.85%,7976756995.00,United States,2022,394312,Utilities,Natural Gas Distribution
KNW,Know Labs Inc. Common Stock,$0.1942,-0.0138,-6.635%,20581316.00,,2022,984996,Industrials,Industrial Machinery/Components
KNX,Knight-Swift Transportation Holdings Inc.,$51.95,0.13,0.251%,8408834800.00,United States,2017,1363014,Industrials,Trucking Freight/Courier Services
KO,Coca-Cola Company (The) Common Stock,$70.44,0.54,0.773%,303587112486.00,United States,,15085802,Consumer Staples,Beverages (Production/Distribution)
KOD,Kodiak Sciences Inc Common Stock,$3.62,0.32,9.697%,190465319.00,United States,2018,540561,Health Care,Biotechnology: Biological Products (No Diagnostic Substances)
KODK,Eastman Kodak Company Common New,$4.74,0.05,1.066%,380622000.00,United States,,345753,Consumer Discretionary,Industrial Machinery/Components
KOF,Coca Cola Femsa S.A.B. de C.V.  American Depositary Shares each representing 10 Units (each Unit consists of 3 Series B Shares and 5 Series L Shares),$86.84,0.00,0.00%,18243627346.00,Mexico,1993,111873,Consumer Staples,Beverages (Production/Distribution)
KOP,Koppers Holdings Inc. Common Stock,$37.03,-0.82,-2.166%,759829531.00,United States,2006,80891,Basic Materials,Forest Products
KOPN,Kopin Corporation Common Stock,$0.7479,-0.0285,-3.671%,90472044.00,United States,1992,492374,Technology,Semiconductors
KORE,KORE Group Holdings Inc. Common Stock,$2.10,0.04,1.942%,37994846.00,United States,,1744,Telecommunications,Telecommunications Equipment
KOS,Kosmos Energy Ltd. Common Shares (DE),$4.22,0.01,0.238%,1991066352.00,Bermuda,2011,5428411,Energy,Oil & Gas Production
KOSS,Koss Corporation Common Stock,$8.06,-0.26,-3.125%,74956348.00,United States,,271622,Consumer Staples,Consumer Electronics/Appliances
KPLT,Katapult Holdings Inc. Common Stock,$9.08,-0.23,-2.47%,37853785.00,United States,2019,24980,Consumer Discretionary,Diversified Commercial Services
KPLTW,Katapult Holdings Inc. Warrant,$0.0057,0.00,0.00%,23763.00,United States,2019,1100,Consumer Discretionary,Diversified Commercial Services
KPRX,Kiora Pharmaceuticals Inc.  Common Stock,$3.47,0.16,4.834%,10307791.00,United States,,12079,Health Care,Biotechnology: Pharmaceutical Preparations
KPTI,Karyopharm Therapeutics Inc. Common Stock,$0.8701,0.0161,1.885%,108487271.00,United States,2013,231213,Health Care,Biotechnology: Pharmaceutical Preparations
KR,Kroger Company (The) Common Stock,$56.53,-0.01,-0.018%,40898679295.00,United States,,2207409,Consumer Staples,Food Chains
KRC,Kilroy Realty Corporation Common Stock,$43.56,0.78,1.823%,5113300662.00,United States,1997,1452311,Real Estate,Real Estate Investment Trusts
KREF,KKR Real Estate Finance Trust Inc. Common Stock,$12.04,0.04,0.333%,834771824.00,United States,2017,281251,Real Estate,Real Estate Investment Trusts
KREF^A,KKR Real Estate Finance Trust Inc. 6.50% Series A Cumulative Redeemable Preferred Stock,$21.30,0.14,0.662%,,United States,,10209,,
KRG,Kite Realty Group Trust Common Stock,$26.44,0.54,2.085%,5807959495.00,United States,2004,1649621,Real Estate,Real Estate Investment Trusts
KRKR,36Kr Holdings Inc. American Depositary Shares,$4.7601,0.1601,3.48%,9283552.00,China,2019,2101,Consumer Discretionary,Business Services
KRMD,KORU Medical Systems Inc. Common Stock (DE),$2.61,0.06,2.353%,119682406.00,United States,,15895,Health Care,Medical/Dental Instruments
KRNT,Kornit Digital Ltd. Ordinary Shares,$24.51,-0.17,-0.689%,1169608205.00,Israel,2015,100899,Industrials,Industrial Machinery/Components
KRNY,Kearny Financial Corp Common Stock,$7.39,-0.13,-1.729%,477243857.00,United States,2005,260859,Finance,Savings Institutions
KRO,Kronos Worldwide Inc Common Stock,$12.10,-0.25,-2.024%,1391939424.00,United States,,105053,Industrials,Major Chemicals
KRON,Kronos Bio Inc. Common Stock,$0.95,0.02,2.151%,57279880.00,United States,2020,21561,Health Care,Biotechnology: Pharmaceutical Preparations
KROS,Keros Therapeutics Inc. Common Stock,$61.25,0.16,0.262%,2298228441.00,United States,2020,340419,Health Care,Biotechnology: Pharmaceutical Preparations
KRP,Kimbell Royalty Partners Common Units Representing Limited Partner Interests,$16.16,-0.04,-0.247%,1543179339.00,United States,2017,222844,Energy,Oil & Gas Production
KRRO,Korro Bio Inc. Common Stock,$80.04,0.03,0.037%,744277153.00,United States,2019,160650,Health Care,Biotechnology: Pharmaceutical Preparations
KRT,Karat Packaging Inc. Common Stock,$27.59,-0.17,-0.612%,552204607.00,United States,2021,42451,Industrials,Plastic Products
KRUS,Kura Sushi USA Inc. Class A Common Stock,$90.51,2.53,2.876%,1017779791.00,United States,2019,152092,Consumer Discretionary,Restaurants
KRYS,Krystal Biotech Inc. Common Stock,$179.19,2.37,1.34%,5148119741.00,United States,2017,189815,Health Care,Biotechnology: Biological Products (No Diagnostic Substances)
KSCP,Knightscope Inc. Class A Common Stock,$11.10,2.10,23.333%,33926240.00,United States,2022,382284,Telecommunications,Telecommunications Equipment
KSM,DWS Strategic Municipal Income Trust,$10.17,-0.03,-0.294%,0.00,United States,1989,23242,Finance,Trusts Except Educational Religious and Charitable
KSPI,Joint Stock Company Kaspi.kz American Depository Shares,$115.20,8.32,7.784%,21811215168.00,Kazakhstan,2024,551420,,
KSS,Kohl's Corporation Common Stock,$20.80,0.77,3.844%,2313759864.00,United States,1992,5086600,Consumer Discretionary,Department/Specialty Retail Stores
KT,KT Corporation Common Stock,$15.75,0.04,0.255%,7762022793.00,South Korea,,497597,Telecommunications,Telecommunications Equipment
KTB,Kontoor Brands Inc. Common Stock ,$83.73,0.61,0.734%,4662527573.00,United States,2019,517040,Consumer Discretionary,Apparel
KTCC,Key Tronic Corporation Common Stock,$5.86,-0.04,-0.678%,63064564.00,United States,1983,21767,Technology,Electrical Products
KTF,DWS Municipal Income Trust,$10.20,0.00,0.00%,402909568.00,United States,1988,182004,Finance,Finance Companies
KTH,Structures Products Cp 8% CorTS Issued by Peco Energy Cap Tr II Preferred Stock,$29.2401,0.02,0.068%,0.00,United States,,615,Finance,Finance: Consumer Services
KTN,Structured Products Corp 8.205% CorTS 8.205% Corporate Backed Trust Securities (CorTS),$27.50,0.0699,0.255%,0.00,United States,,1120,Finance,Finance: Consumer Services
KTOS,Kratos Defense & Security Solutions Inc. Common Stock,$24.85,-0.37,-1.467%,3752332605.00,United States,,576743,Industrials,Military/Government/Technical
KTTA,Pasithea Therapeutics Corp. Common Stock,$4.32,0.33,8.271%,4510430.00,United States,2021,35517,Health Care,Biotechnology: Pharmaceutical Preparations
KTTAW,Pasithea Therapeutics Corp. Warrant,$0.0275,0.006,27.907%,28712.00,United States,2021,2216,Health Care,Biotechnology: Pharmaceutical Preparations
KUKE,Kuke Music Holding Limited American Depositary Shares each representing one Ordinary Share,$0.77,-0.175,-18.519%,25603827.00,,2021,899847,Real Estate,Other Consumer Services
KULR,KULR Technology Group Inc. Common Stock,$0.3035,-0.0044,-1.429%,58572349.00,United States,,1640460,Technology,Electrical Products
KURA,Kura Oncology Inc. Common Stock,$18.00,-0.09,-0.498%,1379420928.00,United States,,251305,Health Care,Biotechnology: Pharmaceutical Preparations
KVAC,Keen Vision Acquisition Corporation Ordinary Shares,$10.77,-0.02,-0.185%,0.00,United States,2023,25211,,
KVACU,Keen Vision Acquisition Corporation Units,$10.61,-0.27,-2.482%,0.00,United States,2023,100,,
KVACW,Keen Vision Acquisition Corporation Warrant,$0.04,-0.0001,-0.249%,0.00,United States,2023,3900,,
KVHI,KVH Industries Inc. Common Stock,$4.76,-0.12,-2.459%,93839049.00,United States,1996,6761,Technology,Radio And Television Broadcasting And Communications Equipment
KVUE,Kenvue Inc. Common Stock,$21.72,0.27,1.259%,41597434972.00,United States,2023,13309680,Consumer Discretionary,Specialty Chemicals
KVYO,Klaviyo Inc. Series A Common Stock,$37.52,0.16,0.428%,10005561430.00,United States,2023,670258,Technology,Computer Software: Prepackaged Software
KW,Kennedy-Wilson Holdings Inc. Common Stock,$11.17,0.11,0.995%,1534891180.00,United States,,421384,Finance,Real Estate
KWE,KWESST Micro Systems Inc. Common Stock,$0.145,0.0044,3.129%,2289550.00,Canada,,208845,Technology,Computer Software: Prepackaged Software
KWESW,KWESST Micro Systems Inc. Warrant,$0.0226,0.0126,126.00%,356854.00,Canada,,400,Technology,Computer Software: Prepackaged Software
KWR,Quaker Houghton Common Stock,$162.23,-2.67,-1.619%,2905888906.00,United States,,63702,Industrials,Major Chemicals
KXIN,Kaixin Holdings Ordinary Shares,$0.1771,0.017,10.618%,10564015.00,China,2017,35104740,Consumer Discretionary,Retail-Auto Dealers and Gas Stations
KYMR,Kymera Therapeutics Inc. Common Stock,$46.41,0.16,0.346%,2865968008.00,United States,2020,222933,Health Care,Biotechnology: Biological Products (No Diagnostic Substances)
KYN,Kayne Anderson Energy Infrastructure Fund Inc.,$11.80,0.12,1.027%,1606352054.00,United States,2004,265924,Finance,Finance/Investors Services
KYTX,Kyverna Therapeutics Inc. Common Stock,$5.64,-0.01,-0.177%,243348245.00,United States,2024,180939,Health Care,Biotechnology: Biological Products (No Diagnostic Substances)
KZIA,Kazia Therapeutics Limited American Depositary Shares,$0.5024,-0.0245,-4.65%,14966496.00,Australia,,2859997,Health Care,Biotechnology: Pharmaceutical Preparations
KZR,Kezar Life Sciences Inc. Common Stock,$0.8238,0.0078,0.956%,60106277.00,United States,2018,237977,Health Care,Biotechnology: Pharmaceutical Preparations
L,Loews Corporation Common Stock,$81.82,0.10,0.122%,17960841012.00,United States,,664917,Finance,Property-Casualty Insurers
LAAC,Lithium Americas (Argentina) Corp. Common Shares,$3.45,0.00,0.00%,556485000.00,Canada,2023,1299357,,
LAB,Standard BioTools Inc. Common Stock,$1.90,0.10,5.556%,705193495.00,United States,2011,954655,Industrials,Biotechnology: Laboratory Analytical Instruments
LAC,Lithium Americas Corp. Common Shares,$3.14,-0.10,-3.086%,506482000.00,Canada,2023,14920017,Basic Materials,Metal Mining
LAD,Lithia Motors Inc. Common Stock,$313.88,-1.49,-0.472%,8393111965.00,United States,,144369,Consumer Discretionary,Retail-Auto Dealers and Gas Stations
LADR,Ladder Capital Corp Class A Common Stock,$11.19,0.00,0.00%,1430821737.00,United States,2014,526181,Real Estate,Real Estate Investment Trusts
LAES,SEALSQ Corp Ordinary Shares,$0.449,0.0062,1.40%,10497620.00,Switzerland,,375132,Technology,Semiconductors
LAKE,Lakeland Industries Inc. Common Stock,$20.71,0.09,0.436%,153183669.00,United States,1986,20098,Health Care,Industrial Specialties
LAMR,Lamar Advertising Company Class A Common Stock,$136.15,0.19,0.14%,13928367333.00,United States,1996,286316,Real Estate,Real Estate Investment Trusts
LANC,Lancaster Colony Corporation Common Stock,$175.78,-2.64,-1.48%,4838696060.00,United States,,96611,Consumer Staples,Packaged Foods
LAND,Gladstone Land Corporation Common Stock,$13.50,-0.04,-0.295%,483818967.00,United States,1993,140080,Real Estate,Real Estate Investment Trusts
LANDM,Gladstone Land Corporation 5.00% Series D Cumulative Term Preferred Stock,$24.52,0.00,0.00%,878758598.00,United States,,8252,Real Estate,Real Estate Investment Trusts
LANDO,Gladstone Land Corporation 6.00% Series B Cumulative Redeemable Preferred Stock,$22.11,0.06,0.272%,792387953.00,United States,,13927,Real Estate,Real Estate Investment Trusts
LANDP,Gladstone Land Corporation 6.00% Series C Cumulative Redeemable Preferred Stock,$21.56,-0.045,-0.208%,772676810.00,United States,,16851,Real Estate,Real Estate Investment Trusts
LANV,Lanvin Group Holdings Limited Ordinary Shares,$1.56,0.1299,9.083%,204314869.00,Cayman Islands,1996,4069,Finance,Blank Checks
LARK,Landmark Bancorp Inc. Common Stock,$20.25,-0.14,-0.687%,111423762.00,United States,,1146,Finance,Major Banks
LASE,Laser Photonics Corporation Common Stock,$6.23,-0.15,-2.351%,76444760.00,United States,2022,1841654,Miscellaneous,Industrial Machinery/Components
LASR,nLIGHT Inc. Common Stock,$11.02,-0.21,-1.87%,530344784.00,United States,2018,183271,Technology,Semiconductors
LATG,Chenghe Acquisition I Co. Class A Ordinary Shares,$11.655,0.035,0.301%,189393750.00,Mexico,2022,219012,Finance,Blank Checks
LATGU,Chenghe Acquisition I Co. Unit,$11.56,-0.13,-1.112%,0.00,Mexico,2022,2500,Finance,Blank Checks
LAUR,Laureate Education Inc. Common Stock,$15.83,0.11,0.70%,2414799507.00,United States,2017,457041,Real Estate,Other Consumer Services
LAW,CS Disco Inc. Common Stock,$5.97,0.01,0.168%,355098215.00,United States,2021,111505,Technology,Computer Software: Prepackaged Software
LAZ,Lazard Inc. Common Stock,$53.41,-0.18,-0.336%,4815979700.00,Bermuda,2005,695686,Finance,Investment Managers
LAZR,Luminar Technologies Inc.  Class A Common Stock,$0.8394,0.0149,1.807%,414462595.00,United States,2019,20329492,Consumer Discretionary,Auto Parts:O.E.M.
LB,LandBridge Company LLC Class A Shares Representing Limited Liability Company Interests,$54.67,1.92,3.64%,3999198136.00,,2024,294373,Energy,Oil & Gas Production
LBPH,Longboard Pharmaceuticals Inc. Common Stock,$59.21,0.04,0.068%,2303240638.00,United States,2021,3285066,Health Care,Biotechnology: Pharmaceutical Preparations
LBRDA,Liberty Broadband Corporation Class A Common Stock,$79.23,-0.38,-0.477%,11317844584.00,United States,,87396,Telecommunications,Cable & Other Pay Television Services
LBRDK,Liberty Broadband Corporation Class C Common Stock,$79.70,-0.36,-0.45%,11384983129.00,United States,,739795,Telecommunications,Cable & Other Pay Television Services
