Symbol,Name,Last Sale,Net Change,% Change,Market Cap,Country,IPO Year,Volume,Sector,Industry
DGICB,Donegal Group Inc. Class B Common Stock,$13.40,0.00,0.00%,448680910.00,United States,1986,19,Finance,Property-Casualty Insurers
DGII,Digi International Inc. Common Stock,$30.70,-0.05,-0.163%,1117946149.00,United States,1989,128254,Telecommunications,Computer Communications Equipment
DGLY,Digital Ally Inc. Common Stock,$1.035,0.0591,6.056%,3990091.00,United States,,68037,Technology,Radio And Television Broadcasting And Communications Equipment
DGX,Quest Diagnostics Incorporated Common Stock,$149.65,0.69,0.463%,16658620177.00,United States,,631429,Health Care,Medical Specialities
DH,Definitive Healthcare Corp. Class A Common Stock,$4.54,0.07,1.566%,531738928.00,United States,2021,361910,Technology,Computer Software: Prepackaged Software
DHAI,DIH Holdings US Inc. Class A Common Stock,$1.70,-0.01,-0.585%,68926390.00,United States,2024,11179,Health Care,Medical/Dental Instruments
DHAIW,DIH Holding US Inc. Warrants,$0.0292,-0.0148,-33.636%,1183912.00,United States,2024,2941,Health Care,Medical/Dental Instruments
DHC,Diversified Healthcare Trust Common Shares of Beneficial Interest,$3.70,-0.02,-0.538%,890126061.00,United States,,508826,Real Estate,Real Estate Investment Trusts
DHCNI,Diversified Healthcare Trust 5.625% Senior Notes due 2042,$16.585,-0.005,-0.03%,3989929923.00,United States,,10242,Real Estate,Real Estate Investment Trusts
DHCNL,Diversified Healthcare Trust 6.25% Senior Notes Due 2046,$17.70,-0.01,-0.056%,4258170615.00,United States,,8644,Real Estate,Real Estate Investment Trusts
DHF,BNY Mellon High Yield Strategies Fund Common Stock,$2.605,0.01,0.385%,0.00,United States,1998,275285,Finance,Finance Companies
DHI,D.R. Horton Inc. Common Stock,$194.56,3.61,1.891%,63434361078.00,United States,,2234632,Consumer Discretionary,Homebuilding
DHIL,Diamond Hill Investment Group Inc. Class A Common Stock,$160.90,-0.92,-0.569%,442639601.00,United States,,7328,Finance,Investment Managers
DHR,Danaher Corporation Common Stock,$274.38,2.40,0.882%,198160825165.00,United States,,1949811,Industrials,Industrial Machinery/Components
DHT,DHT Holdings Inc.,$11.39,0.06,0.53%,1833784783.00,Jersey,2005,848734,Consumer Discretionary,Marine Transportation
DHX,DHI Group Inc. Common Stock,$1.87,0.00,0.00%,90515226.00,United States,2007,57933,Consumer Discretionary,Business Services
DHY,Credit Suisse High Yield Bond Fund Common Stock,$2.21,-0.005,-0.226%,0.00,United States,1998,218324,Finance,Finance/Investors Services
DIAX,Nuveen Dow 30SM Dynamic Overwrite Fund Common Shares of Beneficial Interest,$15.06,-0.06,-0.397%,0.00,,2014,62364,Finance,Finance Companies
DIBS,1stdibs.com Inc. Common Stock,$4.55,-0.09,-1.94%,180603778.00,United States,2021,35885,Consumer Discretionary,Catalog/Specialty Distribution
DIN,Dine Brands Global Inc. Common Stock,$32.72,-0.31,-0.939%,500583771.00,United States,,501167,Consumer Discretionary,Restaurants
DINO,HF Sinclair Corporation Common Stock,$44.27,-0.05,-0.113%,8447455929.00,United States,1960,1519163,Energy,Natural Gas Distribution
DIOD,Diodes Incorporated Common Stock,$63.98,-0.96,-1.478%,2964294552.00,United States,,207878,Technology,Semiconductors
DIS,Walt Disney Company (The) Common Stock,$97.28,0.74,0.767%,176425780326.00,United States,,8598219,Consumer Discretionary,Services-Misc. Amusement & Recreation
DIST,Distoken Acquisition Corporation Ordinary Shares,$10.91,-0.01,-0.092%,0.00,China,2023,4100,Finance,Blank Checks
DISTR,Distoken Acquisition Corporation Right,$0.1173,0.0073,6.636%,0.00,China,2023,842,Finance,Blank Checks
DISTW,Distoken Acquisition Corporation Warrant,$0.0182,-0.005,-21.552%,0.00,China,2023,842,Finance,Blank Checks
DIT,AMCON Distributing Company Common Stock,$140.00,0.00,0.00%,88250680.00,United States,1999,23,Consumer Discretionary,Food Distributors
DJCO,Daily Journal Corp. (S.C.) Common Stock,$492.42,-8.79,-1.754%,678272111.00,United States,,3160,Consumer Discretionary,Newspapers/Magazines
DJT,Trump Media & Technology Group Corp. Common Stock,$29.58,-0.32,-1.07%,5759692536.00,United States,2024,26942140,Technology,Computer Software: Programming Data Processing
DJTWW,Trump Media & Technology Group Corp. Warrants,$21.72,-0.6295,-2.817%,4229226568.00,United States,2021,381438,Technology,Computer Software: Programming Data Processing
DK,Delek US Holdings Inc. Common Stock,$17.11,-0.25,-1.44%,1104255874.00,United States,2017,1350297,Energy,Integrated oil Companies
DKL,Delek Logistics Partners L.P. Common Units representing Limited Partner Interests,$38.67,-0.16,-0.412%,1826382205.00,United States,2012,229551,Energy,Natural Gas Distribution
DKNG,DraftKings Inc. Class A Common Stock,$38.46,0.81,2.151%,18673499376.00,United States,2019,7603300,Consumer Discretionary,Services-Misc. Amusement & Recreation
DKS,Dick's Sporting Goods Inc Common Stock,$218.66,3.62,1.683%,17801706011.00,United States,2002,588220,Consumer Discretionary,Other Specialty Stores
DLB,Dolby Laboratories Common Stock,$74.82,0.76,1.026%,7133909153.00,United States,2005,265319,Miscellaneous,Multi-Sector Companies
DLHC,DLH Holdings Corp.,$8.66,-0.22,-2.477%,122823836.00,United States,,64315,Consumer Discretionary,Professional Services
DLNG,Dynagas LNG Partners LP Common Units,$3.81,0.00,0.00%,140351915.00,Greece,,11004,Consumer Discretionary,Marine Transportation
DLNG^A,Dynagas LNG Partners LP 9.00% Series A Cumulative Redeemable Preferred Units,$25.58,-0.1299,-0.505%,,Greece,,5817,,
DLNG^B,Dynagas LNG Partners LP 8.75% Series B Fixed to Floating Rate Cumulative Redeemable Perpetual Preferred Units liquidation preference $25.00 per Uni,$26.02,0.03,0.115%,,Greece,,2456,,
DLO,DLocal Limited Class A Common Shares,$8.72,-0.28,-3.111%,2581047319.00,Uruguay,2021,983777,Consumer Discretionary,Business Services
DLPN,Dolphin Entertainment Inc. Common Stock,$1.54,0.12,8.451%,17106606.00,United States,,34967,Consumer Discretionary,Other Consumer Services
DLR,Digital Realty Trust Inc. Common Stock,$165.38,1.69,1.032%,54147238787.00,United States,2004,986002,Real Estate,Real Estate Investment Trusts
DLR^J,Digital Realty Trust Inc. 5.250% Series J Cumulative Redeemable Preferred Stock,$24.32,-0.21,-0.856%,,United States,,20101,,
DLR^K,Digital Realty Trust Inc. 5.850% Series K Cumulative Redeemable Preferred Stock par value $0.01 per share,$24.90,-0.09,-0.36%,,United States,,13450,,
DLR^L,Digital Realty Trust Inc. 5.200% Series L Cumulative Redeemable Preferred Stock,$24.09,-0.09,-0.372%,,United States,,8737,,
DLTH,Duluth Holdings Inc. Class B Common Stock,$4.05,-0.145,-3.456%,141893374.00,United States,2015,26657,Consumer Discretionary,Clothing/Shoe/Accessory Stores
DLTR,Dollar Tree Inc. Common Stock,$68.20,0.34,0.501%,14662462516.00,United States,1995,3447912,Consumer Discretionary,Department/Specialty Retail Stores
DLX,Deluxe Corporation Common Stock,$19.49,-0.31,-1.566%,861675080.00,United States,,199693,Consumer Discretionary,Publishing
DLY,DoubleLine Yield Opportunities Fund Common Shares of Beneficial Interest,$16.23,-0.07,-0.429%,778159993.00,United States,2020,172324,Finance,Investment Managers
DM,Desktop Metal Inc. Class A Common Stock,$4.97,0.03,0.607%,165171022.00,United States,2019,156367,Technology,Industrial Machinery/Components
DMA,Destra Multi-Alternative Fund Common Stock,$8.83,-0.01,-0.113%,0.00,,2022,7775,Finance,Trusts Except Educational Religious and Charitable
DMAC,DiaMedica Therapeutics Inc. Common Stock,$4.34,0.05,1.166%,185525591.00,United States,2018,22078,Health Care,Biotechnology: Pharmaceutical Preparations
DMB,BNY Mellon Municipal Bond Infrastructure Fund Inc. Common Stock,$11.0101,-0.0099,-0.09%,0.00,,2013,27969,Finance,Trusts Except Educational Religious and Charitable
DMF,BNY Mellon Municipal Income Inc. Common Stock,$7.34,0.04,0.548%,457214868.00,United States,1988,23786,Finance,Finance/Investors Services
DMLP,Dorchester Minerals L.P. Common Units Representing Limited Partnership Interests,$32.92,1.07,3.359%,1319717107.00,United States,,87462,Energy,Oil & Gas Production
DMO,Western Asset Mortgage Opportunity Fund Inc. Common Stock,$12.27,0.02,0.163%,0.00,United States,2010,26477,Finance,Trusts Except Educational Religious and Charitable
DMRC,Digimarc Corporation Common Stock,$30.00,0.50,1.695%,642618750.00,United States,,71223,Technology,EDP Services
DMYY,dMY Squared Technology Group Inc. Class A Common Stock,$10.545,-0.095,-0.893%,0.00,,2022,43704,Finance,Blank Checks
DNA,Ginkgo Bioworks Holdings Inc. Class A Common Stock,$8.88,0.50,5.967%,493509419.00,United States,2021,1036379,Health Care,Biotechnology: Biological Products (No Diagnostic Substances)
DNB,Dun & Bradstreet Holdings Inc. Common Stock,$11.54,0.08,0.698%,5098211998.00,United States,2020,1796382,Finance,Finance: Consumer Services
DNLI,Denali Therapeutics Inc. Common Stock,$27.59,0.17,0.62%,3949929634.00,United States,2017,514767,Health Care,Biotechnology: Biological Products (No Diagnostic Substances)
DNMR,Danimer Scientific Inc. Common Stock,$0.40,-0.0132,-3.195%,48068044.00,United States,2020,620579,Industrials,Major Chemicals
DNN,Denison Mines Corp Ordinary Shares (Canada),$2.38,0.15,6.726%,2123840441.00,Canada,,43625812,Basic Materials,Other Metals and Minerals
DNOW,DNOW Inc. Common Stock,$12.43,-0.21,-1.661%,1323422038.00,United States,2014,1620954,Industrials,Metal Fabrications
DNP,DNP Select Income Fund Inc. Common Stock,$9.72,0.02,0.206%,0.00,United States,1987,282729,Finance,Investment Managers
DNTH,Dianthus Therapeutics Inc. Common Stock,$29.05,1.02,3.639%,852742996.00,United States,2018,212699,Health Care,Biotechnology: Pharmaceutical Preparations
DNUT,Krispy Kreme Inc. Common Stock,$11.59,0.12,1.046%,1965664000.00,United States,2021,1002389,Consumer Staples,Food Chains
DOC,Healthpeak Properties Inc. Common Stock,$22.64,0.33,1.479%,15831957613.00,United States,,3709154,Real Estate,Real Estate Investment Trusts
DOCN,DigitalOcean Holdings Inc. Common Stock,$43.32,-0.49,-1.118%,3988140829.00,United States,2021,804234,Technology,Computer Software: Programming Data Processing
DOCS,Doximity Inc. Class A Common Stock,$43.50,0.64,1.493%,8076236100.00,United States,2021,914588,Technology,EDP Services
DOCU,DocuSign Inc. Common Stock,$72.30,-0.20,-0.276%,14674927150.00,United States,1989,2315968,Technology,Computer Software: Prepackaged Software
DOGZ,Dogness (International) Corporation Class A Common Stock,$40.00,2.74,7.354%,424870520.00,China,2017,26938,Consumer Discretionary,Miscellaneous manufacturing industries
DOLE,Dole plc Ordinary Shares,$16.15,-0.26,-1.584%,1533106241.00,Ireland,2021,397652,Consumer Staples,Farming/Seeds/Milling
DOMH,Dominari Holdings Inc. Common Stock,$1.81,-0.07,-3.723%,11359810.00,United States,,15696,Health Care,Biotechnology: Pharmaceutical Preparations
DOMO,Domo Inc. Class B Common Stock,$7.78,-0.05,-0.639%,300548137.00,United States,2018,381558,Technology,Computer Software: Prepackaged Software
DOOO,BRP Inc. (Recreational Products) Common Subordinate Voting Shares,$57.50,0.23,0.402%,4197647028.00,Canada,,118845,Consumer Discretionary,Industrial Specialties
DORM,Dorman Products Inc. Common Stock,$116.88,-1.26,-1.067%,3573288905.00,United States,,118341,Consumer Discretionary,Auto Parts:O.E.M.
DOUG,Douglas Elliman Inc. Common Stock,$1.55,0.01,0.649%,142340555.00,United States,2021,304120,Finance,Real Estate
DOV,Dover Corporation Common Stock,$194.38,-0.50,-0.257%,26719011981.00,United States,,985503,Industrials,Industrial Machinery/Components
DOW,Dow Inc. Common Stock ,$53.11,0.03,0.057%,37225915797.00,United States,2019,2395702,Industrials,Major Chemicals
DOX,Amdocs Limited Ordinary Shares,$90.99,0.05,0.055%,10677478051.00,Guernsey,,328141,Technology,EDP Services
DOYU,DouYu International Holdings Limited ADS,$9.18,0.44,5.034%,290414569.00,China,2019,101277,Technology,Computer Software: Programming Data Processing
DPCS,DP Cap Acquisition Corp I Class A Ordinary Shares,$11.48,0.01,0.087%,0.00,United States,2021,4759,Finance,Blank Checks
DPCSU,DP Cap Acquisition Corp I Unit,$11.4589,0.2489,2.22%,0.00,United States,2021,1000,Finance,Blank Checks
DPCSW,DP Cap Acquisition Corp I Warrants,$0.0149,0.00,0.00%,0.00,United States,2021,246,Finance,Blank Checks
DPG,Duff & Phelps Utility and Infrastructure Fund Inc.,$11.81,0.07,0.596%,0.00,United States,2011,75451,Finance,Trusts Except Educational Religious and Charitable
DPRO,Draganfly Inc. Common Shares,$3.03,0.05,1.678%,10564574.00,Canada,,62994,Industrials,Aerospace
DPZ,Domino's Pizza Inc Common Stock,$428.85,-0.53,-0.123%,14809038765.00,United States,2004,380747,Consumer Discretionary,Food Distributors
DQ,DAQO New Energy Corp. American Depositary Shares each representing five ordinary shares,$18.99,1.10,6.149%,1253481494.00,China,2010,860506,Technology,Semiconductors
DRCT,Direct Digital Holdings Inc. Class A Common Stock,$2.95,0.04,1.375%,43256437.00,United States,2022,104191,Consumer Discretionary,Advertising
DRD,DRDGOLD Limited American Depositary Shares,$12.03,0.61,5.342%,1040100218.00,South Africa,,425325,Basic Materials,Precious Metals
DRH,Diamondrock Hospitality Company Common Stock,$9.00,-0.10,-1.099%,1865318490.00,United States,2005,735041,Real Estate,Real Estate Investment Trusts
DRH^A,Diamondrock Hospitality Company 8.250% Series A Cumulative Redeemable Preferred Stock,$25.7335,-0.1845,-0.712%,,United States,,5368,,
DRI,Darden Restaurants Inc. Common Stock,$164.59,0.32,0.195%,19339403345.00,United States,,723435,Consumer Discretionary,Restaurants
DRIO,DarioHealth Corp. Common Stock,$1.03,0.03,3.00%,30929128.00,Israel,,30197,Health Care,Medical/Dental Instruments
DRMA,Dermata Therapeutics Inc. Common Stock,$1.61,0.03,1.899%,2118729.00,United States,2021,342494,Health Care,Biotechnology: Pharmaceutical Preparations
DRRX,DURECT Corporation Common Stock,$1.32,0.06,4.762%,40971983.00,United States,2000,90280,Health Care,Biotechnology: Pharmaceutical Preparations
DRS,Leonardo DRS Inc. Common Stock,$28.72,-0.13,-0.451%,7573544617.00,Israel,,734231,Industrials,Industrial Machinery/Components
DRTS,Alpha Tau Medical Ltd. Ordinary Shares,$2.25,-0.05,-2.174%,156758877.00,Israel,,23993,Health Care,Medical/Dental Instruments
DRUG,Bright Minds Biosciences Inc. Common Stock,$47.21,25.51,117.558%,210737745.00,Canada,,27135943,Health Care,Biotechnology: Pharmaceutical Preparations
DRVN,Driven Brands Holdings Inc. Common Stock,$14.67,0.12,0.825%,2407081150.00,United States,2021,861685,Consumer Discretionary,Automotive Aftermarket
DSGN,Design Therapeutics Inc. Common Stock,$5.595,-0.425,-7.06%,316791837.00,United States,2021,144830,Health Care,Biotechnology: Pharmaceutical Preparations
DSGR,Distribution Solutions Group Inc. Common Stock,$40.17,0.07,0.175%,1878243151.00,United States,,36965,Consumer Discretionary,Industrial Specialties
DSGX,Descartes Systems Group Inc. (The) Common Stock,$106.41,-0.59,-0.551%,9095993306.00,Canada,,84910,Technology,Computer Software: Prepackaged Software
DSL,DoubleLine Income Solutions Fund Common Shares of Beneficial Interests,$12.74,0.01,0.079%,1299439589.00,United States,2013,256643,Finance,Trusts Except Educational Religious and Charitable
DSM,BNY Mellon Strategic Municipal Bond Fund Inc. Common Stock,$6.24,0.02,0.322%,0.00,United States,1989,82778,Finance,Investment Managers
DSP,Viant Technology Inc. Class A Common Stock,$11.85,-0.05,-0.42%,748909122.00,United States,2021,69089,Technology,Computer Software: Programming Data Processing
DSS,DSS Inc. Common Stock,$1.2839,-0.0061,-0.473%,9073029.00,United States,,3395,Consumer Discretionary,Containers/Packaging
DSU,Blackrock Debt Strategies Fund Inc. Common Stock,$10.88,0.08,0.741%,0.00,United States,1998,149447,Finance,Finance Companies
DSWL,Deswell Industries Inc. Common Shares,$2.61,-0.03,-1.136%,41590974.00,Macau,1995,2800,Industrials,Plastic Products
DSX,Diana Shipping inc. common stock,$2.39,0.02,0.844%,286711372.00,Greece,2005,234719,Consumer Discretionary,Marine Transportation
DSX^B,Diana Shipping Inc. Perpetual Preferred Shares Series B (Marshall Islands),$26.47,-0.08,-0.301%,,Greece,,2609,,
DSY,Big Tree Cloud Holdings Limited Ordinary Shares,$5.11,-0.47,-8.423%,291681590.00,China,,23771,Consumer Discretionary,Containers/Packaging
DSYWW,Big Tree Cloud Holdings Limited Warrants,$0.0388,-0.0015,-3.722%,2214725.00,China,,8576,Consumer Discretionary,Containers/Packaging
DT,Dynatrace Inc. Common Stock,$54.86,0.86,1.593%,16343091561.00,United States,2019,2715178,Technology,Computer Software: Prepackaged Software
DTB,DTE Energy Company 2020 Series G 4.375% Junior Subordinated Debentures due 2080,$21.51,0.03,0.14%,4453001921.00,United States,2020,9295,Utilities,Electric Utilities: Central
DTC,Solo Brands Inc. Class A Common Stock,$1.33,-0.01,-0.746%,121867951.00,United States,2021,181945,Consumer Discretionary,Recreational Games/Products/Toys
DTCK,Davis Commodities Limited Ordinary Shares,$1.08,-0.06,-5.263%,26460675.00,Singapore,2023,85248,Industrials,Farming/Seeds/Milling
DTE,DTE Energy Company Common Stock,$128.90,0.46,0.358%,26684888312.00,United States,,776960,Utilities,Electric Utilities: Central
DTF,DTF Tax-Free Income 2028 Term Fund Inc. Common Stock,$11.31,0.0299,0.265%,79504403.00,United States,1991,1230,Finance,Investment Managers
DTG,DTE Energy Company 2021 Series E 4.375% Junior Subordinated Debentures,$21.90,-0.03,-0.137%,4533739752.00,United States,2021,6410,Utilities,Electric Utilities: Central
DTI,Drilling Tools International Corporation Common Stock,$3.47,0.01,0.289%,120425295.00,United States,2021,59778,Industrials,Metal Fabrications
DTIL,Precision BioSciences Inc. Common Stock,$8.94,-0.02,-0.223%,64669814.00,United States,2019,42871,Health Care,Biotechnology: Biological Products (No Diagnostic Substances)
DTM,DT Midstream Inc. Common Stock ,$87.09,0.83,0.962%,8457455863.00,United States,2021,481141,Utilities,Natural Gas Distribution
DTSQ,DT Cloud Star Acquisition Corporation Ordinary Shares,$10.0085,-0.0015,-0.015%,0.00,United States,2024,11859,,
DTSQR,DT Cloud Star Acquisition Corporation Right,$0.12,-0.01,-7.692%,0.00,United States,2024,13082,,
DTSQU,DT Cloud Star Acquisition Corporation Units,$10.13,0.00,0.00%,0.00,United States,2024,137,,
DTSS,Datasea Inc. Common Stock,$2.29,0.08,3.62%,11804442.00,China,,113469,Technology,Computer Software: Prepackaged Software
DTST,Data Storage Corporation Common Stock,$3.54,-0.05,-1.393%,24765210.00,United States,,30193,Technology,EDP Services
DTSTW,Data Storage Corporation Warrant,$0.4501,-0.0641,-12.466%,3148819.00,United States,,5892,Technology,EDP Services
DTW,DTE Energy Company 2017 Series E 5.25% Junior Subordinated Debentures due 2077,$24.74,0.02,0.081%,5121676779.00,United States,2017,8602,Utilities,Electric Utilities: Central
DUET,DUET Acquisition Corp. Class A Common Stock,$11.26,0.00,0.00%,0.00,Malaysia,2022,47,Finance,Blank Checks
DUK,Duke Energy Corporation (Holding Company) Common Stock,$120.76,0.18,0.149%,93251078017.00,United States,,3562231,Utilities,Power Generation
DUK^A,Duke Energy Corporation Depositary Shares each representing a 1/1000th interest in a share of 5.75% Series A Cumulative Redeemable Perpetual Preferred Stock,$25.30,-0.17,-0.667%,,United States,,33896,,
DUKB,Duke Energy Corporation 5.625% Junior Subordinated Debentures due 2078,$25.26,-0.04,-0.158%,19505815094.00,United States,2018,9963,Utilities,Power Generation
DUO,Fangdd Network Group Ltd. Class A Ordinary Shares,$1.16,0.08,7.407%,7389200.00,China,2019,8156150,Finance,Real Estate
DUOL,Duolingo Inc. Class A Common Stock,$286.12,-1.53,-0.532%,12457306864.00,United States,2021,334884,Technology,Computer Software: Prepackaged Software
DUOT,Duos Technologies Group Inc. Common Stock,$3.91,0.08,2.089%,30067779.00,United States,,41830,Technology,Computer Software: Prepackaged Software
DV,DoubleVerify Holdings Inc. Common Stock,$17.35,0.00,0.00%,2950277471.00,United States,2021,882623,Technology,Computer Software: Programming Data Processing
DVA,DaVita Inc. Common Stock,$161.97,1.87,1.168%,13589283000.00,United States,,575208,Health Care,Misc Health and Biotechnology Services
DVAX,Dynavax Technologies Corporation Common Stock,$10.95,0.03,0.275%,1434935994.00,United States,2004,2415754,Health Care,Biotechnology: Pharmaceutical Preparations
DVN,Devon Energy Corporation Common Stock,$40.66,0.08,0.197%,25461292000.00,United States,1985,6939987,Energy,Oil & Gas Production
DWSN,Dawson Geophysical Company Common Stock,$1.7841,-0.0159,-0.883%,55140781.00,United States,,3199,Energy,Oil & Gas Production
DWTX,Dogwood Therapeutics Inc. Common Stock,$3.86,-0.15,-3.741%,5142554.00,United States,2020,73395,Health Care,Biotechnology: Pharmaceutical Preparations
DX,Dynex Capital Inc. Common Stock,$12.63,-0.03,-0.237%,943559211.00,United States,,3784937,Real Estate,Real Estate Investment Trusts
DX^C,Dynex Capital Inc. 6.900% Series C Fixed-to-Floating Rate Cumulative Redeemable Preferred Stock,$25.19,0.04,0.159%,,United States,,6576,,
DXC,DXC Technology Company Common Stock ,$21.05,-0.21,-0.988%,3806118492.00,United States,,1161882,Technology,EDP Services
DXCM,DexCom Inc. Common Stock,$72.38,2.83,4.069%,29004607521.00,United States,2005,3694017,Health Care,Medical/Dental Instruments
DXLG,Destination XL Group Inc. Common Stock,$2.93,-0.02,-0.678%,170695131.00,United States,,303221,Consumer Discretionary,Clothing/Shoe/Accessory Stores
DXPE,DXP Enterprises Inc. Common Stock,$52.06,-0.42,-0.80%,821960451.00,United States,,532222,Industrials,Industrial Machinery/Components
DXR,Daxor Corporation Common Stock,$9.13,0.00,0.00%,44189200.00,United States,,83,Health Care,Medical/Dental Instruments
DXYZ,Destiny Tech100 Inc. Common Stock,$11.71,0.78,7.136%,0.00,,2024,391382,,
DY,Dycom Industries Inc. Common Stock,$198.33,2.03,1.034%,5772224681.00,United States,,310158,Industrials,Water Sewer Pipeline Comm & Power Line Construction
DYAI,Dyadic International Inc. Common Stock,$1.1609,0.0309,2.735%,34220591.00,United States,,5600,Health Care,Biotechnology: Biological Products (No Diagnostic Substances)
DYCQ,DT Cloud Acquisition Corporation Ordinary Shares,$10.43,0.0941,0.91%,0.00,United Kingdom,2024,43175,,
DYCQR,DT Cloud Acquisition Corporation Right,$0.25,0.00,0.00%,0.00,United Kingdom,2024,97,,
DYN,Dyne Therapeutics Inc. Common Stock,$35.24,0.51,1.468%,3538124122.00,United States,2020,1596541,Health Care,Biotechnology: Pharmaceutical Preparations
E,ENI S.p.A. Common Stock,$30.76,0.08,0.261%,51921924810.00,Italy,,242371,Energy,Oil & Gas Production
EA,Electronic Arts Inc. Common Stock,$144.35,0.15,0.104%,38137260040.00,United States,,1557470,Technology,Computer Software: Prepackaged Software
EAD,Allspring Income Opportunities Fund Common Shares,$6.95,0.00,0.00%,0.00,United States,2003,168094,Finance,Finance/Investors Services
EAF,GrafTech International Ltd. Common Stock,$1.74,0.05,2.959%,447470801.00,United States,2018,1351707,Energy,Industrial Machinery/Components
EAI,Entergy Arkansas LLC First Mortgage Bonds 4.875% Series Due September 1 2066,$23.54,0.14,0.598%,5033578115.00,United States,2016,115690,Utilities,Electric Utilities: Central
EARN,Ellington Credit Company Common Shares of Beneficial Interest,$7.03,0.06,0.861%,178048747.00,United States,2013,217629,Real Estate,Real Estate Investment Trusts
EAST,Eastside Distilling Inc. Common Stock,$0.627,0.0448,7.695%,1105708.00,United States,,115228,Consumer Staples,Beverages (Production/Distribution)
EAT,Brinker International Inc. Common Stock,$92.46,3.16,3.539%,4156829255.00,United States,,1546840,Consumer Discretionary,Restaurants
EB,Eventbrite Inc. Class A Common Stock,$2.98,0.14,4.93%,286381397.00,United States,2018,1290700,Technology,Computer Software: Programming Data Processing
EBAY,eBay Inc. Common Stock,$64.95,-0.41,-0.627%,31760550000.00,United States,1998,5186485,Consumer Discretionary,Business Services
EBC,Eastern Bankshares Inc. Common Stock,$17.28,-0.20,-1.144%,3726402607.00,United States,2020,1022624,Finance,Savings Institutions
EBF,Ennis Inc. Common Stock,$20.85,-0.39,-1.836%,542180356.00,United States,,141294,Consumer Discretionary,Office Equipment/Supplies/Services
EBMT,Eagle Bancorp Montana Inc. Common Stock,$16.70,0.02,0.12%,133880293.00,United States,2010,19076,Finance,Major Banks
EBON,Ebang International Holdings Inc. Class A Ordinary Shares,$6.17,0.37,6.379%,40376097.00,China,2020,6135,Technology,Semiconductors
EBR,Centrais Electricas Brasileiras S A American Depositary Shares (Each representing one Common Share),$6.69,-0.07,-1.036%,15024497547.00,Brazil,2016,806595,Utilities,Electric Utilities: Central
EBS,Emergent BioSolutions Inc. Common Stock,$9.35,0.21,2.298%,494676934.00,United States,2006,1121452,Health Care,Biotechnology: Pharmaceutical Preparations
EBTC,Enterprise Bancorp Inc Common Stock,$32.87,-0.97,-2.866%,408385229.00,United States,,17948,Finance,Major Banks
EC,Ecopetrol S.A. American Depositary Shares,$8.23,0.08,0.982%,16919519869.00,Colombia,,3146095,Energy,Oil & Gas Production
ECAT,BlackRock ESG Capital Allocation Term Trust Common Shares of Beneficial Interest,$17.35,-0.10,-0.573%,1876142250.00,United States,2021,226932,Finance,Trusts Except Educational Religious and Charitable
ECBK,ECB Bancorp Inc. Common Stock,$15.0775,0.0275,0.183%,138530125.00,United States,2022,5872,Finance,Banks
ECC           ,Eagle Point Credit Company Inc. Common Stock,$9.72,0.02,0.206%,589639733.00,United States,2014,429703,Finance,Trusts Except Educational Religious and Charitable
ECC^D,Eagle Point Credit Company Inc. 6.75% Series D Preferred Stock,$19.99,0.26,1.318%,,United States,,227417,,
ECCC,Eagle Point Credit Company Inc. 6.50% Series C Term Preferred Stock due 2031,$23.14,-0.01,-0.043%,1403730805.00,United States,,2414,Finance,Trusts Except Educational Religious and Charitable
ECCF,Eagle Point Credit Company Inc. 8.00% Series F Term Preferred Stock due 2029,$24.90,0.01,0.04%,27107953417.00,United States,,7715,,
ECCV,Eagle Point Credit Company Inc. 5.375% Notes due 2029,$23.1654,0.0354,0.153%,1405271633.00,United States,2022,1929,Finance,Trusts Except Educational Religious and Charitable
