Symbol,Name,Last Sale,Net Change,% Change,Market Cap,Country,IPO Year,Volume,Sector,Industry
PSA^G,Public Storage Depositary Shares Each Representing 1/1000 of a 5.05% Cumulative Preferred Share of Beneficial Interest Series G,$24.85,-0.09,-0.361%,,United States,,14882,,
PSA^H,Public Storage Depositary Shares Each Representing 1/1000 of a  5.60% Cumulative Preferred  Share of Beneficial Interest Series H,$25.24,0.0501,0.199%,,United States,,4719,,
PSA^I,Public Storage Depositary Shares Each Representing 1/1000 of a 4.875% Cumulative Preferred Share of Beneficial Interest Series I par value $0.01 per share,$23.48,-0.19,-0.803%,,United States,,10691,,
PSA^J,Public Storage Depositary Shares Each Representing 1/1000 of a 4.700% Cumulative Preferred Share of Beneficial Interest Series J par value $0.01 per share,$22.90,-0.10,-0.435%,,United States,,10478,,
PSA^K,Public Storage Depositary Shares Each Representing 1/1000 of a 4.75% Cumulative Preferred Share of Beneficial Interest Series K,$22.98,0.02,0.087%,,United States,,10928,,
PSA^L,Public Storage Depositary Shares Each Representing 1/1000 of a 4.625% Cumulative Preferred Share of Beneficial Interest Series L par value $0.01 per share,$22.59,-0.10,-0.441%,,United States,,26898,,
PSA^M,Public Storage Depositary Shares Each Representing 1/1000 of a 4.125% Cumulative Preferred Share of Beneficial Interest Series M,$20.45,0.07,0.343%,,United States,,7360,,
PSA^N,Public Storage Depositary Shares Each Representing 1/1000 of a 3.875% Cumulative Preferred Share of Beneficial Interest Series N,$18.84,-0.15,-0.79%,,United States,,12615,,
PSA^O,Public Storage Depositary Shares Each Representing 1/1000 of a 3.900% Cumulative Preferred Share of Beneficial Interest Series O,$18.77,-0.11,-0.583%,,United States,,14269,,
PSA^P,Public Storage Depositary Shares Each Representing 1/1000 of a 4.000% Cumulative Preferred Share of Bene cial Interest Series P,$19.40,-0.28,-1.423%,,United States,,30677,,
PSA^Q,Public Storage Depositary Shares Each Representing 1/1000 of a 3.950% Cumulative Preferred Share of Beneficial Interest Series Q par value $0.01 per share,$19.249,0.059,0.307%,,United States,,6635,,
PSA^R,Public Storage Depositary Shares Each Representing 1/1000 of a 4.00% Cumulative Preferred Share of Bene cial Interest Series R,$19.66,-0.10,-0.506%,,United States,,23669,,
PSA^S,Public Storage Depositary Shares Each Representing 1/1000 of a 4.100% Cumulative Preferred Share of Beneficial Interest Series S,$20.24,-0.06,-0.296%,,United States,,20942,,
PSBD,Palmer Square Capital BDC Inc. Common Stock,$16.24,-0.01,-0.062%,0.00,,2024,17520,,
PSEC,Prospect Capital Corporation Common Stock,$5.30,0.02,0.379%,2273637550.00,United States,2004,1548344,Finance,Finance: Consumer Services
PSEC^A,Prospect Capital Corporation 5.35% Series A Fixed Rate Cumulative Perpetual Preferred Stock,$21.25,0.18,0.854%,,United States,,13124,,
PSF,Cohen & Steers Select Preferred and Income Fund Inc. Common Stock,$20.84,0.22,1.067%,1024049008.00,,2010,57441,Finance,Investment Managers
PSFE,Paysafe Limited Common Shares,$22.74,-0.09,-0.394%,1403500134.00,,2021,108292,Consumer Discretionary,Business Services
PSHG,Performance Shipping Inc. Common Shares,$1.88,0.00,0.00%,23085791.00,Greece,,28818,Consumer Discretionary,Marine Transportation
PSIG,PS International Group Ltd. Ordinary Shares,$0.8324,0.0144,1.76%,20213117.00,Hong Kong,,25097,Consumer Discretionary,Oil Refining/Marketing
PSMT,PriceSmart Inc. Common Stock,$92.96,-0.28,-0.30%,2848200789.00,United States,,88565,Consumer Discretionary,Department/Specialty Retail Stores
PSN,Parsons Corporation Common Stock,$107.98,-0.29,-0.268%,11465870553.00,United States,2019,440449,Technology,EDP Services
PSNL,Personalis Inc. Common Stock,$4.87,0.25,5.411%,321030400.00,United States,2019,366528,Health Care,Medical Specialities
PSNY,Polestar Automotive Holding UK PLC Class A ADS,$1.28,0.05,4.065%,2733069169.00,Sweden,,2291392,Consumer Discretionary,Auto Manufacturing
PSNYW,Polestar Automotive Holding UK PLC Class C-1 ADS (ADW),$0.2243,0.0137,6.505%,478927668.00,Sweden,,46851,Consumer Discretionary,Auto Manufacturing
PSO,Pearson Plc Common Stock,$13.52,-0.07,-0.515%,9007049201.00,United Kingdom,,215257,Consumer Discretionary,Books
PSQH,PSQ Holdings Inc. Class A Common Stock,$2.74,0.04,1.481%,86012970.00,,2021,57545,Consumer Discretionary,Advertising
PSTG,Pure Storage Inc. Class A Common Stock,$57.07,0.58,1.027%,18701376391.00,United States,2015,3282068,Technology,Electronic Components
PSTL,Postal Realty Trust Inc. Class A Common Stock,$14.71,0.05,0.341%,338820225.00,United States,2019,53513,Real Estate,Real Estate Investment Trusts
PSTV,PLUS THERAPEUTICS Inc. Common Stock ,$1.44,0.03,2.128%,8490720.00,United States,,18763,Health Care,Medical/Dental Instruments
PSTX,Poseida Therapeutics Inc. Common Stock,$2.45,-0.09,-3.543%,237944429.00,United States,2020,559011,Health Care,Biotechnology: Biological Products (No Diagnostic Substances)
PSX,Phillips 66 Common Stock,$132.60,-0.75,-0.562%,55502273666.00,United States,,1712386,Energy,Integrated oil Companies
PT,Pintec Technology Holdings Limited American Depositary Shares,$1.00,0.0016,0.16%,15947961.00,China,2018,52498,Technology,Computer Software: Programming Data Processing
PTA,Cohen & Steers Tax-Advantaged Preferred Securities and Income Fund Common Shares of Beneficial Interest,$20.89,-0.13,-0.618%,1154662517.00,United States,2020,87062,Finance,Trusts Except Educational Religious and Charitable
PTC,PTC Inc. Common Stock,$184.40,-0.82,-0.443%,22152936596.00,United States,,424488,Technology,Computer Software: Prepackaged Software
PTCT,PTC Therapeutics Inc. Common Stock,$39.10,2.09,5.647%,3007735047.00,United States,2013,572077,Health Care,Biotechnology: Pharmaceutical Preparations
PTEN,Patterson-UTI Energy Inc. Common Stock,$7.98,0.01,0.125%,3136537444.00,United States,1993,13755026,Energy,Oil & Gas Production
PTGX,Protagonist Therapeutics Inc. Common Stock,$46.97,-0.05,-0.106%,2766748357.00,United States,2016,588702,Health Care,Biotechnology: Pharmaceutical Preparations
PTHL,Pheton Holdings Ltd Class A Ordinary Shares,$4.52,-0.02,-0.441%,65540000.00,China,2024,123284,Health Care,Biotechnology: Electromedical & Electrotherapeutic Apparatus
PTIX,Protagenic Therapeutics Inc. Common Stock,$0.5481,0.0081,1.50%,2448508.00,United States,,3592,Health Care,Biotechnology: Pharmaceutical Preparations
PTLE,PTL LTD Ordinary Shares,$4.50,0.36,8.696%,0.00,Singapore,2024,238359,Energy,Oil Refining/Marketing
PTLO,Portillo's Inc. Class A Common Stock,$12.38,-0.07,-0.562%,765017420.00,United States,2021,919533,Consumer Discretionary,Restaurants
PTMN,Portman Ridge Finance Corporation Common Stock,$18.35,0.01,0.055%,169627840.00,United States,2006,20430,Finance,Finance: Consumer Services
PTN,Palatin Technologies Inc. Common Stock,$0.98,-0.02,-2.00%,19157204.00,United States,1999,163682,Health Care,Biotechnology: Pharmaceutical Preparations
PTON,Peloton Interactive Inc. Class A Common Stock,$5.84,0.57,10.816%,2198289354.00,United States,2019,29858963,Consumer Discretionary,Recreational Games/Products/Toys
PTPI,Petros Pharmaceuticals Inc. Common Stock,$0.32,-0.0001,-0.031%,3074137.00,United States,,87160,Health Care,Biotechnology: Pharmaceutical Preparations
PTSI,P.A.M. Transportation Services Inc. Common Stock,$16.82,-0.50,-2.887%,365919285.00,United States,1986,18279,Industrials,Trucking Freight/Courier Services
PTVE,Pactiv Evergreen Inc. Common stock,$12.10,-0.20,-1.626%,2168981108.00,United States,2020,188514,Consumer Discretionary,Containers/Packaging
PTY,Pimco Corporate & Income Opportunity Fund,$14.54,0.04,0.276%,0.00,United States,2002,578606,Finance,Investment Managers
PUBM,PubMatic Inc. Class A Common Stock,$15.29,-0.01,-0.065%,758141057.00,United States,2020,249413,Technology,Computer Software: Programming Data Processing
PUK,Prudential Public Limited Company Common Stock,$17.64,0.54,3.158%,23855255479.00,United Kingdom,,1045975,Finance,Life Insurance
PULM,Pulmatrix Inc. Common Stock,$2.0204,-0.0096,-0.473%,7379077.00,United States,2014,10062,Health Care,Biotechnology: Pharmaceutical Preparations
PUMP,ProPetro Holding Corp. Common Stock,$7.75,-0.26,-3.246%,807256872.00,United States,2017,712777,Energy,Oilfield Services/Equipment
PVBC,Provident Bancorp Inc. (MD) Common Stock,$10.75,-0.17,-1.557%,189923765.00,United States,2015,39059,Finance,Banks
PVH,PVH Corp. Common Stock,$101.03,0.94,0.939%,5638898321.00,United States,,541737,Consumer Discretionary,Apparel
PVL,Permianville Royalty Trust Trust Units ,$1.595,0.005,0.314%,52635000.00,United States,2011,50314,Energy,Oil & Gas Production
PW,Power REIT (MD) Common Stock,$1.23,0.10,8.85%,4169283.00,United States,1998,84097,Real Estate,Real Estate Investment Trusts
PW^A,Power REIT 7.75% Series A Cumulative Perpetual Preferred Stock,$3.47,0.00,0.00%,,United States,,481,,
PWM,Prestige Wealth Inc. Class A Ordinary Shares,$0.858,0.058,7.25%,7850700.00,Hong Kong,2023,258654,Finance,Finance: Consumer Services
PWOD,Penns Woods Bancorp Inc. Common Stock,$25.23,-0.29,-1.136%,190348517.00,United States,,3956,Finance,Major Banks
PWP,Perella Weinberg Partners Class A Common Stock,$22.18,0.06,0.271%,1903913855.00,United States,2020,211346,Finance,Finance: Consumer Services
PWR,Quanta Services Inc. Common Stock,$314.27,1.13,0.361%,46301329646.00,United States,,449192,Industrials,Engineering & Construction
PWUP,PowerUp Acquisition Corp. Class A Ordinary Shares,$11.72,0.02,0.171%,0.00,United States,2022,2506,Finance,Blank Checks
PWUPU,PowerUp Acquisition Corp. Unit,$13.70,0.84,6.532%,0.00,United States,2022,3255,Finance,Blank Checks
PWUPW,PowerUp Acquisition Corp. Warrant,$0.0228,0.0018,8.571%,0.00,United States,2022,250,Finance,Blank Checks
PX,P10 Inc. Class A Common Stock,$11.29,0.04,0.356%,1260854758.00,United States,2021,423850,Finance,Investment Managers
PXDT,Pixie Dust Technologies Inc. American Depositary Shares ,$1.63,0.03,1.875%,24236579.00,Japan,2023,1137,Health Care,Biotechnology: Electromedical & Electrotherapeutic Apparatus
PXLW,Pixelworks Inc.  Common Stock,$0.833,-0.0494,-5.598%,48773553.00,United States,2000,353814,Technology,Semiconductors
PXS,Pyxis Tankers Inc. Common Stock,$4.93,0.09,1.86%,51974757.00,Greece,,20568,Consumer Discretionary,Marine Transportation
PXSAP,Pyxis Tankers Inc. 7.75% Series A Cumulative Convertible Preferred Shares,$24.9701,-0.0108,-0.043%,263248453.00,Greece,,762,Consumer Discretionary,Marine Transportation
PXSAW,Pyxis Tankers Inc. Warrant,$0.70,0.00,0.00%,7379783.00,Greece,,1,Consumer Discretionary,Marine Transportation
PYCR,Paycor HCM Inc. Common Stock,$14.36,0.21,1.484%,2567885571.00,United States,2021,586789,Technology,Computer Software: Prepackaged Software
PYN,PIMCO New York Municipal Income Fund III Common Shares of Beneficial Interest,$6.16,0.01,0.163%,0.00,United States,2002,8607,Finance,Investment Managers
PYPD,PolyPid Ltd. Ordinary Shares,$3.59,0.16,4.665%,24424486.00,Israel,2020,878,Health Care,Biotechnology: Pharmaceutical Preparations
PYPL,PayPal Holdings Inc. Common Stock,$80.94,1.12,1.403%,82747664829.00,United States,,8839767,Consumer Discretionary,Business Services
PYT,PPlus Tr GSC-2 Tr Ctf Fltg Rate,$23.13,0.10,0.434%,0.00,United States,,155,Finance,Finance: Consumer Services
PYXS,Pyxis Oncology Inc. Common Stock,$3.75,0.52,16.099%,221033411.00,United States,2021,1669032,Health Care,Biotechnology: Pharmaceutical Preparations
PZC,PIMCO California Municipal Income Fund III Common Shares of Beneficial Interest,$7.49,0.05,0.672%,0.00,United States,2002,24164,Finance,Investment Managers
PZG,Paramount Gold Nevada Corp. Common Stock,$0.435,0.0061,1.422%,28344262.00,United States,2015,287290,Basic Materials,Metal Mining
PZZA,Papa John's International Inc. Common Stock,$54.56,-0.43,-0.782%,1780068340.00,United States,1993,1012478,Consumer Discretionary,Restaurants
QBTS,D-Wave Quantum Inc. Common Shares,$1.17,0.13,12.50%,235672277.00,,2022,13353432,Technology,EDP Services
QCOM,QUALCOMM Incorporated Common Stock,$170.92,-0.18,-0.105%,190404880000.00,United States,1991,6431467,Technology,Radio And Television Broadcasting And Communications Equipment
QCRH,QCR Holdings Inc. Common Stock,$80.79,-0.93,-1.138%,1360658959.00,United States,,59229,Finance,Major Banks
QD,Qudian Inc. American Depositary Shares each representing one Class A Ordinary Share,$2.22,0.15,7.246%,420476549.00,China,2017,675367,Finance,Finance: Consumer Services
QDEL,QuidelOrtho Corporation Common Stock,$40.83,0.76,1.897%,2745221137.00,United States,,601368,Health Care,Biotechnology: In Vitro & In Vivo Diagnostic Substances
QETA,Quetta Acquisition Corporation Common Stock,$10.49,0.035,0.335%,0.00,United States,2023,74508,Finance,Blank Checks
QETAR,Quetta Acquisition Corporation Right,$1.37,0.00,0.00%,0.00,United States,2023,4301,Finance,Blank Checks
QETAU,Quetta Acquisition Corporation Unit,$10.58,-0.22,-2.037%,0.00,United States,2023,7561,Finance,Blank Checks
QFIN,Qifu Technology Inc. American Depositary Shares,$33.37,1.34,4.184%,5180841831.00,China,2018,1556188,Finance,Finance: Consumer Services
QGEN,Qiagen N.V. Common Shares,$43.00,0.31,0.726%,9812718465.00,Netherlands,,1022230,Health Care,Biotechnology: Biological Products (No Diagnostic Substances)
QH,Quhuo Limited American Depository Shares,$1.46,-0.09,-5.806%,9004727.00,China,2020,151078,Consumer Discretionary,Business Services
QIPT,Quipt Home Medical Corp. Common Shares,$2.92,-0.10,-3.311%,125822800.00,United States,,112639,Health Care,Misc Health and Biotechnology Services
QLGN,Qualigen Therapeutics Inc. Common Stock,$0.1672,0.007,4.37%,2032455.00,United States,2015,106555,Health Care,Biotechnology: Pharmaceutical Preparations
QLYS,Qualys Inc. Common Stock,$123.21,-1.22,-0.98%,4535485528.00,United States,2012,566191,Technology,Computer Software: Prepackaged Software
QMCO,Quantum Corporation Common Stock,$4.10,0.55,15.493%,19650029.00,United States,,46141,Technology,Electronic Components
QMMM,QMMM Holdings Limited Ordinary Shares,$10.08,1.00,11.013%,172620000.00,Hong Kong,2024,337580,Consumer Discretionary,Advertising
QNCX,Quince Therapeutics Inc. Common Stock,$0.795,0.0021,0.265%,34404902.00,United States,2019,81603,Health Care,Biotechnology: Biological Products (No Diagnostic Substances)
QNRX,Quoin Pharmaceuticals Ltd. American Depositary Shares,$0.85,0.19,28.788%,3382975.00,Israel,2016,40685535,Health Care,Medical/Dental Instruments
QNST,QuinStreet Inc. Common Stock,$19.20,-0.03,-0.156%,1074741005.00,United States,2010,206071,Consumer Discretionary,Business Services
QNTM,Quantum Biopharma Ltd. Class B Subordinate Voting Shares,$7.55,1.80,31.304%,9818624.00,Canada,,233809,Health Care,Biotechnology: Pharmaceutical Preparations
QQQX,Nuveen NASDAQ 100 Dynamic Overwrite Fund Shares of Beneficial Interest,$25.33,0.15,0.596%,0.00,United States,,51091,Finance,Finance Companies
QRHC,Quest Resource Holding Corporation Common Stock,$8.35,0.10,1.212%,170201833.00,United States,,46431,Utilities,Environmental Services
QRTEA,Qurate Retail Inc. Series A Common Stock ,$0.5626,-0.0111,-1.935%,223308062.00,United States,,1625246,Consumer Discretionary,Catalog/Specialty Distribution
QRTEB,Qurate Retail Inc. Series B Common Stock ,$3.66,-0.15,-3.937%,1452732858.00,United States,,6492,Consumer Discretionary,Catalog/Specialty Distribution
QRTEP,Qurate Retail Inc. 8.0% Fixed Rate Cumulative Redeemable Preferred Stock,$40.76,0.06,0.147%,16178522215.00,United States,,24158,Consumer Discretionary,Catalog/Specialty Distribution
QRVO,Qorvo Inc. Common Stock,$104.50,0.22,0.211%,9913010657.00,United States,,751903,Technology,Semiconductors
QS,QuantumScape Corporation Class A Common Stock,$5.28,-0.06,-1.124%,2672279665.00,United States,2020,7436157,Miscellaneous,Industrial Machinery/Components
QSG,QuantaSing Group Limited American Depositary Shares,$3.28,-0.05,-1.502%,167650650.00,China,2023,213544,Real Estate,Other Consumer Services
QSI,Quantum-Si Incorporated Class A Common Stock,$0.8159,0.0351,4.495%,116152586.00,United States,2020,569250,Industrials,Industrial Machinery/Components
QSIAW,Quantum-Si Incorporated Warrant,$0.08,0.00,0.00%,11388904.00,United States,2020,10973,Industrials,Industrial Machinery/Components
QSR,Restaurant Brands International Inc. Common Shares,$70.55,-0.52,-0.732%,31789950147.00,Canada,2014,1041446,Consumer Discretionary,Restaurants
QTI,QT Imaging Holdings Inc. Common Stock,$0.64,0.06,10.345%,13722506.00,United States,,68611,Health Care,Biotechnology: Electromedical & Electrotherapeutic Apparatus
QTRX,Quanterix Corporation Common Stock,$12.78,0.37,2.981%,490484042.00,United States,2017,221776,Industrials,Biotechnology: Laboratory Analytical Instruments
QTTB,Q32 Bio Inc. Common Stock,$48.78,-0.86,-1.732%,588276361.00,United States,2018,59698,Health Care,Biotechnology: Pharmaceutical Preparations
QTWO,Q2 Holdings Inc. Common Stock,$82.31,0.13,0.158%,4961907887.00,United States,2014,685290,Technology,Computer Software: Prepackaged Software
QUAD,Quad Graphics Inc Class A Common Stock,$5.49,-0.03,-0.543%,286364219.00,United States,,133509,Consumer Discretionary,Publishing
QUBT,Quantum Computing Inc. Common Stock,$0.92,0.05,5.747%,84037529.00,United States,,4079225,Technology,Computer Software: Prepackaged Software
QUIK,QuickLogic Corporation Common Stock,$8.33,0.07,0.847%,120498523.00,United States,1999,107445,Technology,Semiconductors
QURE,uniQure N.V. Ordinary Shares,$6.42,0.14,2.229%,312638714.00,Netherlands,2014,659763,Health Care,Biotechnology: Pharmaceutical Preparations
QVCC,QVC Inc. 6.250% Senior Secured Notes due 2068,$13.97,0.069,0.496%,14.00,United States,2019,7496,Consumer Discretionary,Catalog/Specialty Distribution
QVCD,QVC Inc. 6.375% Senior Secured Notes due 2067,$13.85,0.03,0.217%,14.00,United States,2018,2485,Consumer Discretionary,Catalog/Specialty Distribution
QXO,QXO Inc. Common Stock,$15.40,-0.02,-0.13%,6305225003.00,United States,,752194,Technology,EDP Services
R,Ryder System Inc. Common Stock,$149.08,-0.78,-0.52%,6452656922.00,United States,,301611,Consumer Discretionary,Rental/Leasing Companies
RA,Brookfield Real Assets Income Fund Inc. Common Stock,$13.52,-0.01,-0.074%,0.00,United States,2016,166981,Finance,Investment Managers
RACE,Ferrari N.V. Common Shares,$482.35,0.03,0.006%,117573276521.00,Italy,2015,267909,Consumer Discretionary,Auto Manufacturing
RAIL,FreightCar America Inc. Common Stock,$13.00,1.16,9.797%,245360050.00,United States,2005,477401,Industrials,Railroads
RAMP,LiveRamp Holdings Inc. Common Stock,$25.05,0.25,1.008%,1668621732.00,United States,2018,345240,Technology,EDP Services
RAND,Rand Capital Corporation Common Stock,$16.41,0.00,0.00%,42354555.00,United States,,267,Finance,Finance: Consumer Services
RANI,Rani Therapeutics Holdings Inc. Class A Common Stock,$2.68,0.05,1.901%,143129441.00,United States,2021,1827017,Health Care,Biotechnology: Pharmaceutical Preparations
RAPP,Rapport Therapeutics Inc. Common Stock,$25.95,-2.10,-7.487%,949159059.00,United States,2024,115523,Health Care,Biotechnology: Pharmaceutical Preparations
RAPT,RAPT Therapeutics Inc. Common Stock,$1.79,0.10,5.917%,62477222.00,United States,2019,268790,Health Care,Biotechnology: Pharmaceutical Preparations
RARE,Ultragenyx Pharmaceutical Inc. Common Stock,$56.26,-0.51,-0.898%,5185213589.00,United States,2014,310163,Health Care,Biotechnology: Pharmaceutical Preparations
RAVE,Rave Restaurant Group Inc. Common Stock,$2.78,-0.03,-1.068%,40550653.00,United States,,45736,Consumer Discretionary,Food Distributors
RAY,Raytech Holding Limited Ordinary Shares,$1.46,-0.025,-1.684%,25715101.00,Hong Kong,2024,20557,Consumer Discretionary,Consumer Electronics/Appliances
RAYA,Erayak Power Solution Group Inc. Class A Ordinary Shares,$0.99,-0.11,-10.00%,12325500.00,China,2022,65316,Consumer Discretionary,Metal Fabrications
RBA,RB Global Inc. Common Stock,$81.11,0.57,0.708%,14944842346.00,Canada,,1318657,Consumer Discretionary,Business Services
RBB,RBB Bancorp Common Stock,$23.94,-0.49,-2.006%,426246625.00,United States,2017,33483,Finance,Major Banks
RBBN,Ribbon Communications Inc. Common Stock,$3.41,-0.15,-4.213%,595135692.00,United States,,272460,Technology,EDP Services
RBC,RBC Bearings Incorporated Common Stock,$288.10,-2.10,-0.724%,8421123530.00,United States,2022,110879,Industrials,Metal Fabrications
RBCAA,Republic Bancorp Inc. Class A Common Stock,$69.10,1.35,1.993%,1342894583.00,United States,1998,26268,Finance,Major Banks
RBKB,Rhinebeck Bancorp Inc. Common Stock,$9.29,0.1399,1.529%,103003869.00,United States,2019,953,Finance,Banks
RBLX,Roblox Corporation Class A Common Stock,$39.93,0.07,0.176%,25842696000.00,United States,2021,5750131,Technology,Computer Software: Prepackaged Software
RBOT,Vicarious Surgical Inc. Class A Common Stock,$7.74,0.70,9.943%,45645125.00,Hong Kong,2020,15034,Health Care,Industrial Specialties
RBRK,Rubrik Inc. Class A Common Stock,$39.54,0.06,0.152%,7182567963.00,United States,2024,2250991,Technology,Computer Software: Prepackaged Software
RC,Ready Capital Corporation Common Stock,$7.25,0.00,0.00%,1219557583.00,United States,2013,1049225,Real Estate,Real Estate Investment Trusts
RC^C,Ready Capital Corporation 6.25% Series C Cumulative Convertible Preferred Stock,$18.97,0.02,0.106%,,United States,,543,,
RC^E,Ready Capital Corporation 6.50% Series E Cumulative Redeemable Preferred Stock,$19.4796,0.0696,0.359%,,United States,,3922,,
RCAT,Red Cat Holdings Inc. Common Stock,$3.15,0.11,3.618%,237538470.00,United States,,844758,Technology,Computer Software: Prepackaged Software
RCB,Ready Capital Corporation 6.20% Senior Notes due 2026,$24.40,0.0246,0.101%,4104442072.00,United States,2019,2940,Real Estate,Real Estate Investment Trusts
RCC,Ready Capital Corporation 5.75% Senior Notes due 2026,$24.3211,0.00,0.00%,4091169921.00,United States,2021,75,Real Estate,Real Estate Investment Trusts
RCEL,Avita Medical Inc. Common Stock,$10.63,0.16,1.528%,276270500.00,United States,,48684,Health Care,Medical/Dental Instruments
RCG,RENN Fund Inc Common Stock,$2.12,0.00,0.00%,0.00,United States,,7791,Finance,Investment Managers
RCI,Rogers Communication Inc. Common Stock,$39.07,0.40,1.034%,20756506711.00,Canada,,500458,Telecommunications,Cable & Other Pay Television Services
RCKT,Rocket Pharmaceuticals Inc. Common Stock,$18.82,0.39,2.116%,1712165666.00,United States,2015,529843,Health Care,Biotechnology: Pharmaceutical Preparations
RCKTW,Rocket Pharmaceuticals Inc. Warrant,$0.0709,0.0089,14.355%,6450188.00,United States,,7852,Health Care,Biotechnology: Pharmaceutical Preparations
RCKY,Rocky Brands Inc. Common Stock,$29.77,-0.29,-0.965%,221757325.00,United States,1993,13717,Consumer Discretionary,Shoe Manufacturing
RCL,Royal Caribbean Cruises Ltd. Common Stock,$199.94,-1.27,-0.631%,51468622980.00,United States,1993,1457606,Consumer Discretionary,Marine Transportation
RCM,R1 RCM Inc. Common Stock,$14.25,0.02,0.141%,6015052723.00,United States,,2381337,Consumer Discretionary,Other Consumer Services
RCMT,RCM Technologies Inc. Common Stock,$21.58,-0.15,-0.69%,164633129.00,United States,,17106,Consumer Discretionary,Professional Services
RCON,Recon Technology Ltd. Class A Ordinary Shares,$3.47,0.00,0.00%,51973507.00,China,2009,10518,Energy,Oilfield Services/Equipment
RCS,PIMCO Strategic Income Fund Inc.,$7.44,-0.11,-1.457%,0.00,United States,1994,186025,Finance,Investment Managers
RCUS,Arcus Biosciences Inc. Common Stock,$18.44,0.20,1.096%,1685923192.00,United States,2018,457429,Health Care,Biotechnology: Pharmaceutical Preparations
RDACU,Rising Dragon Acquisition Corp. Unit,$10.01,0.01,0.10%,0.00,China,2024,1156,Finance,Blank Checks
RDCM,Radcom Ltd. Ordinary Shares,$10.63,0.24,2.31%,162721191.00,Israel,1997,4412,Technology,Computer peripheral equipment
RDDT,Reddit Inc. Class A Common Stock,$80.90,4.61,6.043%,13419372769.00,United States,2024,5424120,Technology,EDP Services
RDFN,Redfin Corporation Common Stock,$11.23,0.69,6.546%,1367524940.00,United States,2017,6129458,Finance,Real Estate
RDHL,Redhill Biopharma Ltd. American Depositary Shares,$8.785,0.58,7.069%,11249535.00,Israel,,13879,Health Care,Biotechnology: Pharmaceutical Preparations
RDI,Reading International Inc Class A Common Stock,$1.63,-0.02,-1.212%,36554680.00,United States,,66820,Consumer Discretionary,Movies/Entertainment
RDIB,Reading International Inc Class B Common Stock,$7.26,-1.71,-19.064%,162814096.00,United States,,20087,Consumer Discretionary,Movies/Entertainment
RDN,Radian Group Inc. Common Stock,$35.32,-0.52,-1.451%,5312793959.00,United States,,1254475,Finance,Property-Casualty Insurers
RDNT,RadNet Inc. Common Stock,$68.16,-0.20,-0.293%,5040926842.00,United States,,447656,Health Care,Medical Specialities
RDUS,Radius Recycling Inc. Class A Common Stock,$18.11,-0.39,-2.108%,507794512.00,United States,,135210,Consumer Discretionary,Industrial Specialties
RDVT,Red Violet Inc. Common Stock ,$30.97,2.18,7.572%,425265051.00,United States,,143806,Technology,Computer Software: Prepackaged Software
RDW,Redwire Corporation Common Stock,$8.52,0.04,0.472%,566882775.00,United States,2021,402008,Industrials,Military/Government/Technical
RDWR,Radware Ltd. Ordinary Shares,$23.24,0.21,0.912%,969081878.00,Israel,1999,628311,Consumer Discretionary,Business Services
RDY,Dr. Reddy's Laboratories Ltd Common Stock,$79.67,-0.13,-0.163%,13290411252.00,India,,145370,Health Care,Biotechnology: Pharmaceutical Preparations
RDZN,Roadzen Inc. Ordinary Shares,$0.9001,0.0893,11.014%,61603590.00,United States,2022,352532,Finance,Specialty Insurers
RDZNW,Roadzen Inc. Warrants,$0.0821,0.0074,9.906%,5618992.00,United States,2022,524,Finance,Specialty Insurers
REAL,The RealReal Inc. Common Stock,$3.05,-0.13,-4.088%,330919525.00,United States,2019,1441977,Consumer Discretionary,Other Specialty Stores
REAX,The Real Brokerage Inc. Common Shares,$5.14,-0.06,-1.154%,1004356000.00,Canada,,542446,Finance,Real Estate
REBN,Reborn Coffee Inc. Common Stock,$2.49,-0.05,-1.969%,9343750.00,United States,2022,24264,Consumer Discretionary,Restaurants
